disgust,"I broke an egg, with which there was something wrong, into a  
little cup. There was a thick white ""wad"" in it. I tried to take  
it out and throw it in the sink.",
shame,"I was 10 years old I stained our bench with a fountain-pen,  
I tried to twin the cushions, but then there were colour nuances.  
Then my mother catched me, she saw it and became very angry.",
neutral,"I liked to see off my aunt (from Zaire) to the airport. That  
appeared to be impossible because I had to go to school. For long  
time I wasn't sure if I could accompany her. Two days before the  
departure they told me I was allowed to miss school.",
fear,"I went to the ballet lessons with a little friend in the dark. On  
a very quiet place a boy approached us from behind and asked at  
what time the lesson would be finished. I gave him an avoiding  
answer, he took me up and wanted to run away with me.",
anger,"I was sleeping nicely until in the middle of the night I became  
awake because a friend called me for some (in my opinion)  
nonsens reason.",
disgust,"On school, during a fancy fair, there was a stand of amnesty  
international. There I read (for the first time) a description of  
the tortures of a woman, what they did to her.",
shame,"A friend catched me while masturbating. I am not fully sure  
whether she saw it or not.",
guilt,"I was 4-5 years old my mother gave me some parts of a  
chocolate bar and ordered me to bring it to my father working  
outside. On my way I could not resist the temptation and ate it  
myself.",
fear,"I had left my home, my father, under false pretences, got me  
in his car and drove home where we were all alone. He was seethed  
with rage because I withrew from his authority. He hit me, kicked  
me and threatened me.",
anger,"my father took away my cherised diaries to burn them (I was  
also very sad) ""Oh, how I hated him"".",
sadness,"I felt very sad I left home because I could not stand it any  
longer. I do not regret it, but I missed my little sister very  
much (and she missed me). These feelings wear off over time.",
shame,"my mother found a leaf of my diary where I had written about  
my mother's lack of education, especially her poor arithmetical  
insight.",
guilt,"Very often I take care for my little sister and oversee her  
duties. Most of the time everything went fine, but sometimes she  
absolutely didn't want to obey; then I hit her (we frequently  
were hit by our father).",
fear,"I was six years old we were on holiday in France. There was  
very heavy weather then.",
anger,"A quarrel with my mother because I thought she said very  
unreasonable things about me, that hit me strongly.",
sadness,"The disease and subsequent death of a close acquaintance. Sadness  
was accompanied with feelings of powerlessness (I also  
experienced sadness in the situation described under guilt).",
disgust,"I take a look into a slaughter-house and listening to  
stories about torturing people or animals.",
shame,"Making bloopers: e.g. telling something negative about a certain  
person, while that person is standing besides you and hears  
everything.",
guilt,"I wanted to finish a relationship after 3 months. Unfortunately  
my friend had a different opinion. I could not answer his  
feelings this made him unhappy, and me feel guilty.",
neutral,"a friend of mine had her period, while thinking she was  
pregnant.",
fear,Fear to come and live in Nijmegen.,
anger,the coach of our team degraded me to the second team.,
sadness,a friend died.,
disgust,"I saw a documentary film about World War II (about Hitler  
and his adepts).",
shame,"I embarrassed a friend by asking him aloud if a certain  
person was ""the source of gossip"" he told me about, while that  
person was also present.",
guilt,"I realised that I had rejected a boy, who was fallen in love  
with me, rather bluntly four times.",
neutral,"Spending the nitht with close friends, after being away (out of  
Nijmegen) for a while.",
fear,"Just before I started my study I had to move, I was very afraid  
to be left alone and that I could not manage it.",
anger,"anybody wants to make me feel guilty. For example: I should  
do something for my mother, but things didn't go as she hoped.  
Then she threatens: I'll do it myself.",
sadness,"a close friend took leave of me, because she went to Israel  
for one year.",
disgust,"I wanted to take something from under my bed. While doing this I  
felt a dead bird laying under my bed.",
shame,"I stayed at home for a period because I felt depressive and I  
neglected my study people adked me, I told them that I had  
freeterm and studied hard. I felt ashamed for my behavior and  
lies.",
guilt,"After a quarrel with my mother in which matters were ""inflated""  
enormously.",
neutral,"A fellow player, quite unexpectedly, scores a goal, which means a  
draw.",
fear,"In college, I started a discussion with the teacher referring to  
a question I posed. I felt very unsure and I was afraid to fail.",
anger,"While playing indoor-hockey, there always is an older man who  
frequently and intentionally plays the ball out of the field. In  
my opinion this is very childish, because we play for fun only.",
sadness,"I was together with my family one night, a few days after my  
father had died, during that conversation I expressed my  
displeasure because nobody understands me.",
disgust,"Salo, a movie film by Pasolini. People were misused and tortured  
for the fun of a few elder Italian authorities, during World War  
II.",
shame,"I was jerking me off in my bedroom, suddenly, my mother came  
in. She looked at me and immediately left the room.",
fear,"I was walking alone in the street late at night (2.30 am). It was  
very quiet. Then a man approached me and said ""Hello"".",
anger,"When, late at night, I discovered that they had stolen my bike.",
sadness,"a friend, after being free of drugs for half a year, started  
using them again. 
",
disgust,"In a disco, there was a dirty little chap who punched my bottom.",
anger,"a friend who comes visiting me unexpectedly asks for coffee  
and I refuse to give him this.",
sadness,"Watching a football game. This remindes me of the time my  
father was still alive and we watched football games on TV  
together.",
disgust,Seeing someone who has bleeding nose.,
shame,"Asking someone to give me back the money I once lend him because  
I needed it myself.",
guilt,"I tell someone no. In other words I refuse to do  
something although I could have helped him.",
neutral,I got a good grade for an exam in statistics.,
fear,"One night at three o'clock I was followed by a cardriver, who  
tried to molest me.",
disgust,"I read a book about torture. The book described exactly how the  
torturing was done.",
shame,"I made a joke about the rat of a boy. I compared his rat with a  
sausage. I told the boy he had a delicious sausage.",
guilt,"After a courtship of three months I made an end to it. The boy  
was very sad about this.",
neutral,I had a very pleasant conversation with one of my friends.,
fear,"I had a dream about my fiancTe leaving me and making an end to  
our relation.",
anger,My bicycle was demolished.,
disgust,"A fellow student who seemed very nice later on proved to be a  
slimy fellow towards a professor.",
shame,"My father was very angry with another man in the presence of my  
friends.",
guilt,"I once drank too much alcohol and became very ill. This was in the  
presence of my friends.",
neutral,"This week I was phoned by an old friend with whom I lost contact  
a few years ago.",
fear,I was raped by a friend.,
anger,"Last year I had a friend visiting me for several days. The only  
thing he did was sleeping, drinking, taking pills and thinking  
only about himself.",
sadness,"My father suddenly fell ill. He stayed for 3 months in the  
hospital: the last month on intensive care of the Academic  
Hospital, then he died.",
disgust,"Bisshop Ter Schure intoduced himself on TV to the Dutch Nation.  
He spoke as if he was God himself, and didn't discuss the way he  
had achieved this position.",
shame,After having failed my driving test.,
neutral,"I thought that someone was angry with me but, by hindsight, that  
didn't appear to be the case, he even liked me.",
fear,"Once, late at night, I was biking home and overtook a man. He  
said to me ""Hello darling"" I was terrified and imagined the  
wildest scenes.",
disgust,"I read about or think about environmental pollution, the  
armor race, starvation, etc. Then one realizes that mankind is  
bad, most important is power and money, at the cost of nature and  
mankind.",
shame,I imitated a teacher behind his back - walking very silly.,
guilt,"I told someone that I still had a relationship with a boy  
although it was finished already 3 months before. That person  
seriously discussed several things relating that issue. Then I  
felt very miserable because I had told lies.",
neutral,"A meeting and a conversation with a woman (somewhat elder than  
me) who considers me as her child (she also has one child of her  
own). Last two years I lived with her (no relationship).",
fear,"As a child I suffered of nightmares. Even since than, I have  
never been so anxious and fearful.",
anger,"talking with my sister, she often ventilates prejudices,  
which my father also adheres.",
sadness,"I was in a hopeless situation in a dirty place. No study, no  
work, only loneliness.",
disgust,"It is very difficult to relate it to a certain event. I am  
familiar with the disgust of Sartre (la nausTe), a frequently  
occurring cause may be described as ""the self-assured dullness"".",
shame,"Recently, I left my bag in the car of someone who picked me up  
while hitch-hiking. I spent some effort to find out where he  
lived (I succeeded).",
guilt,"In Biarritz (the South of France) I met some English students  
who, especially for me, went to Paris and gave me food, while I  
didn't have any more money.",
neutral,"I passed the driving test already on the first try, although  
I felt more and more uncertain as the day came near.",
fear,"my father suffered with dizziness. He had to be  
hospitalized, because the physician didn't know what was wrong.  
Because his stools were black, I thought it could be cancer.",
sadness,"it suddenly appeared that our dog was dangerously ill and  
probably would die. We had not expected this because he  
was always very healthy. Fortunately he survived because we, in turn,  
gave him medicines during the night.",
guilt,"my father told me that I should help my mother more often,  
because she was so busy. And I realized that he was right.",
fear,"I lived in a student-house, where you shared the lavatory and  
shower with a fellow student. the shower cubicle formed the  
connection between both appartments. My neighbour very often was  
drunk and aggressive. One night, I was afraid that he would enter  
my room.",
anger,"I suffer from a disease of my muscles. Therefore, I am only able  
to attend lectures for half a day. So, sometimes I miss  
obligatory lectures. However, the teachers do not take into  
account my disease, and punish me with detention work, resulting in  
an overload.",
sadness,"I suffer form a disease of my muscles. However, I cannot talk  
about it and my feelings, the consequence with my parents. They  
try to repress it.",
shame,"Going out for dinner, or during one ice-cream and four spoons.",
guilt,"I borrowed a piece of music of someone and I always forgot to  
give it back. That person wrote me a letter asking me to give it  
back. I did so and I told him an idle story why I kept it for so  
long.",
fear,armed robbers broke into our house at night.,
anger,"a pick-pocket robbed me of my money (K20) while I  was  
buying bathing soap.",
disgust,"my friend who was drunk insulted me in public for no reason at  
all.",
shame,I tried to steal a book from the bookshop and was caught.,
guilt,"I was caught with another man's wife.  I had taken the  
opportuinty as this man was abroad but he returned that night.",
fear,"I had gone for a boxing tournament which ended at 2 o'clock  
in the morning.  I was alone on my way back, and I could hear the  
barking of the dogs, the nocturnal animals and the sound of my      
own footsteps.  There had been a rumour  circulating that there  
were ghosts in that area.",
anger,"In 1983 a sadist provoked my sister in my presence.  He tried  
to force my sister into accompanying him to his place, but my  
sister did not agree and so she was kicked and she fell down.   
There was a fight.",
sadness,"my father passed away in 1978.  I was left alone with my  
mother who was very sick so I had to go and live with my aunt, who  
is very short tempered, till my mother was discharged from the  
hospital.",
guilt,I broke my friend's badminton racket and she kept quiet about it.,
neutral,"""Boy, you have been admitted to the medicine school and your  
uncle is coming back fron Canada next week,"" my father told me  
and it was a happy moment.",
fear,"I was in form five at the boarding school and my friends and I  
had gone drinknig beer in the nearby village.  And we were caught  
red handed there by a form master.",
anger,my mother quarrelled with my aunt over me.,
disgust,"I found out accidentaly that while my uncle was away in Canada, my  
aunt had been bedding a young man on a regular basis.",
shame,"It was during a school holiday - I was found necking a girl in my  
room by my father.",
neutral,"I won the first prize at the science fair, the first of the kind  
at school and I was only in form II then.  ",
fear,"A close relative of mine died in a serious car accident.  I was  
one of the first two people to see the corpse and I had to do it.  
 Before going in to see it I was afraid as it was the first time  
that I was seeing a corpse.",
sadness,"a close relative of mine passed away, it was the first time  
that someone so close to me had died.",
disgust,"A person whom I thought to be honest took and spend the little  
money that I had and I had no way of getting any money in the  
few following months.",
shame,"While watching a religious film, I got very excited and made a  
number of comments which were reproached to me by an elderly  
person who respected me.",
guilt,"I beat up a female friend after I heard the defamatory stories that  
she had been telling.  I was later called to explain my  
behaviour.",
anger,"some seniors tried to scold and insult some juniors on  
account of what the juniors were supposed to have said at  
secondary school.",
sadness,"an uncle of mine, who was close to me, passed away after  
having had a stroke, before his first daughter could be named.",
shame,"I could not hold my bladder while making a telephone call  
and ended up wetting myself.",
guilt,"I was made to feel responsible for the emotional state a friend of  
mine was in.",
sadness,My fiancT left me for my best friend.,
disgust,People who discriminate other people disgust me.,
shame,"On New Years eve I drank too much alcohol, so much that I had to  
vomit in the presence of other people.",
guilt,"I have cut loose from my father a few years ago. I know he is  
very sad about this.",
neutral,A recurrent lovesickness.,
sadness,The dying of a close member of the family.,
disgust,"Seeing maltreated, dead animals.",
shame,"A much older man took advantage of me during my childhood (four  
to eight years of age).",
guilt,"my friend needed my help very much and I, at that moment, made  
an end to our relationship.",
neutral,I passed a very important exam.,
fear,"a man rang the doorbell and wanted to enter the house with  
violence. I was alone at home that moment.",
anger,"A friend came to visit me late one night. He promised to stay  
only a quarter of an hour, but he stayed 5 hours !! He didn't  
leave and I was very angry.",
sadness,"I had to terminate a training because I wasn't suited for it. I  
was very sad about this, because I very much wanted to finish  
that training.",
shame,"I tried to swindle a jeweller because my watch was broken and I  
wanted to have it repaired it was a pity but they detected it.",
guilt,"Someone had to do a lot of efforts to make something work. With  
my help he would have finished much sooner, but I wasn't in the  
mood to help him.",
neutral,I went to visit friends and it was very companionable.,
fear,"I wanted to get in contact with a girl I loved, but I was afraid  
she would refuse me.",
anger,"During military service a superior reproached me unjustly. This  
led to friction in a lot of situations.",
sadness,"Disappointed love. The girl made an end to our relationship while  
I thought she was in love with me.",
disgust,"During military service I heard the story of someone who tried to  
commit suicide and as a result of this got a week custody.",
shame,"I thought of myself as being clumsy I made love for the  
first time with a girl.",
guilt,"A friend of mine had a bicycle-accident because I pulled at his  
handlebar.",
neutral,"Sitting alone in a quiet room concentrating on things happening  
around me which pleases me.",
fear,"Sitting alone in a quiet room, concetrating on things happening  
around you. Thoughts come into my mind which make me afraid.",
anger,"a teacher tells a story which isn't true. It only reflects  
his way of interpreting reality.",
sadness,"I have high expectations for my future but if I pursue the  
subject in this manner I will not attain this.",
disgust,"I heard a broadcasting programme about parapsychology. The people  
in this programme used very difficult words which I couldn't  
understand. They acted exaggerated without showing any feeling.",
shame,"A girl asked me why I didn't dance. I told her I was ashamed to  
dance. I felt myself ashamed having to tell her this.",
guilt,"I saved up money for a good purpose. As I also have to organise a  
party I am afraid there will rest only a little money for the  
good purpose I feel guilty about this.",
fear,"During a football game I made an offence towards an acquaintance.  
Later on this acquaintance also tackeled me and the game became  
very rude.",
anger,"I work at a petrol station. there is a foreigner who wants  
petrol my collegues treat him very impolite.",
sadness,"An uncle of mine who just retired, having worked hard all his  
life, got a cerebral hemorrhage.",
disgust,"A student who lives in the same house where I live is an alcoholic. He  
tries to manipulate other people with his money he has drunk  
too much.",
shame,"I went to a disco with a friend I started behaving badly  
embarrassing him without reason.",
guilt,"I talked to another student about the notes she got last  
semester, not knowing that she got a lot of bad grades.",
neutral,I got my drivers licence.,
fear,"I stayed alone in a house in Great Brittain and there was a  
lot of rumour in the newspaper about a murderer still being free.",
sadness,my mother was proved to suffer from a very serious disease.,
disgust,"The stories about my aunt who was beaten and humiliated by my  
uncle.",
shame,"I omitted to do a favor to a friend, while he was very much in  
need for help.",
guilt,I had a little accident with my boss'car.,
neutral,"Every year during carnival I am very neutralful I have an intense  
feeling of happiness then.",
fear,"The only event I can remember is having a nightmare I was  
very young (3 years old) I dreamt about a machine which was going  
to crush me.",
anger,"I am usually angry at myself. This happens often. For instace  
I want to pet without falling in love and it soon proves  
that I have fallen in love with him.",
disgust,"There is a person whom I disgust. Evrey time I see her I get this  
terrible feeling I disgust her whole appearance.",
shame,"I am angry at someone without a good reason. Later on it  
proves that he didn't do anything wrong.",
guilt,"My mother always evokes feelings of guilt in me. For instance  
I miss the last bus I know she will be concerned for me and  
stay awake till I arrive.",
neutral,"I came again in contact with a girl I liked very much. And  
most important she also liked me.",
sadness,my father had a cerebral hemorrhage.,
shame,"During a party I overheard a conversation about china. I  
wanted to give my opinion one of the people came out to be Chinese  
and his opinion was right of course.",
neutral,"an old schoolfriend phoned me to arrange an appointment to  
talk about old memories. I hadn't seen him for 8 years.",
fear,"Standing in a crowed shop or in a closed room with too much  
people in it. This gives me a fearful experience.",
disgust,"my parents behave very ""witty"" towards me, they make insipid  
jokes about which they laugh. Or my mother who treats me like a  
little child.",
shame,"Making an unexpected talk with a professor in the canteen. This  
made me shy.",
guilt,"Flirting with other girls while I already had a very good  
relationship. there are problems in my relationship, the  
flirting increases as does the feeling of guilt.",
fear,"I lived alone in a repulsive area in the city of Rotterdam. I was  
annoyed, heard a lot of Burglary and assaults. Especially in the evening  
and the night I frequently felt anxious.",
anger,Being treated unfairly and being hurt by someone I love.,
sadness,"I finished a relation after four years, leading to much  
sorrow for the other one and myself (""although it was the best  
solution"").",
disgust,"Every time I meet a certain person. We cannot get on well  
together, we dislike each other.",
shame,coming up for trial because of shop lifting.,
guilt,Being catched stealing.,
neutral,"I fell over head and ears in love with someone who appeared to be  
in love with me. it made me so happy that I could hardly sleep  
and eat for one week.",
fear,"One night I had to bike home all alone after a party. Then I  
found out that I was pursued by a man in a car.",
anger,"I had a quarrel with my father, because I was of the opinion that  
he decided in an authoritarian way which TV program we should  
watch. I became very angry and started throwing things through  
the room.",
shame,"I was catched when, as a little girl, I played tricks. I was very  
startled then and wet my pants.",
guilt,"I was of the opinion that 12.00 pm was too early to be back at  
home after going out, so I stayed away longer, knowing that my  
mother would be worried.",
neutral,I was called and invited to have a talk about a job I wanted to have.,
fear,"Once late at night (around midnight) a person asked me to give  
him a lift. He suddenly tried to attack me but I could escape.  
After this he followed me for a little while.",
anger,"There was a lot of irritation between me and a person who lives  
in the same house where I live. Suddenly it became too much for me and I  
accused him of several things.",
sadness,"The end of a relationship (after 4 years) by doing this I hurt  
the other person very much.",
disgust,"I saw a terrible accident in which the driver of a motor was  
thrown through the frontwindow of a car. His face was completely  
away.",
shame,"I am troubled by hair growing in my neck. I was troubled by this  
for a long time and was much ashamed someone brought his/her  
hands close to my face.",
neutral,a friend of me came for an unexpected visit.,
fear,I thought the house was on fire at night.,
anger,"I was at an official meeting I asked a question to a person.  
His response was not directed at me but at the chairman.",
sadness,the mother of a good friend of mine died.,
disgust,"A teacher was very blunt in his relation to a child so that the  
child was very upset arriving at home.",
shame,I was very angry at someone.,
guilt,That I didn't take the time to make an appointment with someone.,
neutral,"After I saw my family and good friends back after staying one  
year in a foreign country. ",
fear,"a good friend of mine behaved in a very cool manner to me  
for a very long time.",
anger,"I was in the library of medical psychology and walked into the  
wrong direction. A man who came out of a room threated me very  
denigrating and I became very angry in a resisting manner.",
sadness,"A good friend of mine died. During the funeral I felt an intense  
feeling of sadness.",
disgust,"an uncle of mine who is very ill started to cough wich  
sounded very dirty. (He can't help it of course).",
shame,"At Christmas night there was a good movie on television which I  
wanted to see for years. I was whining about it till someone told  
me it was very childish. Then I felt shame.",
guilt,"A good friend of mine who is at the moment in a foreign country.  
I didn't write her for several months and now I feel guilty.",
neutral,"I go out with my friend with enough money and good sense to  
our favorite dancing.",
fear,going out I am threatened regularly by two punk-girls.,
anger,A friend started to shout at me. He called me an old frump.,
disgust,"My father is someone I disgust. So he comes close to me  
a feeling of disgust overwhelms me. I stay a week-end at my  
parent's place I will remember it for long time.",
shame,"After a party in which I made love with a boy in public. Later on  
I heard that others were talking about me and called me a slut.",
guilt,"I got associated with a boy one year ago, I neglected my  
best friend. the relation with this boy finished she behaved  
very easy-going towards me. I felt guilty then.",
neutral,"I made the winning goal during a very important football  
game.",
fear,"A terrible cloud-burst started we were camping in a tent on  
a great bald field.",
anger,"Seeing for the first time pictures about the so called  
""treatment"" of Jewish people in Nazi-Germany during World War II.",
sadness,"The death of my mother-in-law after a long sick-bed. at the  
moment of dying I was with her.",
disgust,"I was looking at a one-man show on television. He told very  
disgusting things so that I started to be disgusted with it.  
(Later on it proved that this was his intention).",
