anger,some friends betrayed my friendship.,
sadness,"I did bad on a chamistry midterm which I could have done  
well.",
disgust,"an employer of my younger sister (17 yrs) made a ""pass"" at  
her.",
shame,"Defying my parents and staying out all night I wasn't  
supposed to.",
guilt,Yelled at my parents for not buying me a car like other parents.,
neutral,"Riding home from school after completing two midterms in two  
days, and feeling I did well on them.",
fear,"Occured while preparing for a midterm in Social Welfare that I  
thought was going to be very hard and felt unprepared for.",
anger,"Argument with roommate over a lock he had put on kitchen cupboard  
without telling anyone.",
sadness,Day time robbery of our house.,
disgust,Robbery mentioned under sadness.,
shame,Caught lying to my father about a speeding ticket I had received.,
guilt,"Getting a friend an open container ticket because I got caught  
speeding.",
neutral,I found out I got accepted to Berkeley.,
fear,"Before I moved away from home, I feared leaving.",
anger,"a friend carelessly broke and object in my parent's house  
and did not apologize, or pay, or anything.",
sadness,I felt sadness my grandfather died.,
disgust,"This person I know lied about how much income his parents made  
and received money through grants which he did not need. Another  
person is barely making it, did not lie, and did not receive  
enough money.",
shame,After a big fight with my parents.,
fear,"While skiing in Squaw Valley, I was riding up a chair lift and  
right the chair was above a sheer cliff of rocks, the chair  
lift stopped and all the chairs sagged and everything seemed to  
creak loudly.",
anger,"I received a poor grade on a midterm even though I got all the  
right answers and knew the material. I went to the TA to try to  
raise my grade and he wouldn't do it.",
disgust,"I read in the newspaper about a 21 yr. old woman who was found  
naked and dead along a roadside. It turned out she had had two  
relatives 14 and 19 who were kidnapped, raped and killed earlier.",
shame,"I went to bed with a girl and the next day she thought it was the  
start of something serious and I just thought it was fun and I  
told her I wasn't interested in starting a serious relationship.",
fear,"Being involved in a car accident and having my thumb caught in  
the glove compartment. My sister and I had a Fear of finally  
telling my parents, since my sister was the driver.",
anger,"A co-worker and I had to rush a project. I was only working there  
for one month and he for some years. Instead of letting me know  
that he wanted to do the project himself, he went to the  
superviser and let the superviser tell me to let the co-worker do  
it himself since he was quicker at it.",
sadness,"Losing a pet chick. Our family had just put the chick outside a  
few days before and then one morning it was gone.",
disgust,NO RESPONSE,
shame,NO RESPONSE,
guilt,Having told a certain lie.,
fear,"Two summers ago my best friend and I drove into unknown mountains  
at midnight to pick up my broken car. We told one another  
horrifically scary ghost/murder stories and succeeded in scaring  
eachother pretty well - even though somewhere in our heads we  
knew the fears were unjustified.",
sadness,My grandfather died thirteen years ago.,
disgust,"one individual takes advantage of and/or injures another  
relatively defenseless individual, consciously. I feel disgust  
mingled with anger. A person on my dorm floor verbally assaulted  
another person for having a certain religious belief.",
shame,"I borrowed $ 20.00 from a friend and paid him back much later  
than I had originally intended.",
guilt,I angered a close friend and he was injured.,
fear,"I was to meet one of my friends (girl) at the library at 8:00  
already dark. She would be walking alone. She was 45 minutes late  
but I kept waiting, calling her room and other places she could  
have been.",
disgust,"One of my good friends told people something I had told her  
in confidence about someone else.",
neutral,"Football was a very big deal at my high school, so I was neutralous  
my school's team won the conference championship last year.",
fear,"I was driving on to a busy freeway during rush hour and it was  
slightly raining. A diesel truck was coming very close behind me  
and I was close behind a pick-up. I changed lanes and barely hit  
the truck and ran a Honda of the road. I was scared to death to  
go back and see if I caused him to crash.",
anger,"I was really pissed the Russians boycotted the '84 Olympics.  
I had anger towards them and Jimmy Crter. I was very anxious to  
see it.",
sadness,"It made me very sad to hear that some construction company was  
going to build houses on the beautiful hills by my house.",
shame,"I could have died I was caught cheating on a test in high  
school. That was my first and last time.",
neutral,"I took a math midterm and I knew I did really well and it was  
Friday so I felt great neutral because the week was over and I did  
well on a test.",
fear," first came to CAL I went to a rally on Sproul and I later  
learned that the rally was conducted by the Moonie cult. They  
were taking pictures at the rally, so I was afraid that they  
would circulate the pictures and then kidnap people. I did not  
know how the cult worked. I was scared.",
anger,"I was faced with writing an essay and I didn't want to do it  
I was angry that I had to write an essay and angry at myself for  
not having the time to write a good essay.",
sadness,"I ran a race for the CAL track team and I did terribly and then  
the coach said that I should sit out for the season. I felt  
really sad because I wasn't going to be able to run. It was  
something I always had done and now I couldn't do it anymore.",
disgust,"I saw a girl in my economics discussion section smiling and  
asking stupid questions to the TA. just to get attention. She was  
obviously ass-kissing. It happens in every Econ. discussion held  
weekly.",
guilt,"I went to go get a bike innertube fixed. I fixed it and I was  
supposed to pay previously but I didn't. I said I would after I  
fixed the tire. After fixing the tire, the salesperson who helped  
me was gone so I walked out of the store without paying. I felt  
guilty so I went inside and paid for the tire.",
fear,"I feared that my dog's eye was infected too much. He had played  
around in the weeds and a foxtail had gotten under his eyelid. I  
took him to the vet and I feared that he may go blind because of  
the foxtail.",
anger,"One of my friends kept criticizing me about everything I did. I  
thought she was kidding, but later I found out that she was  
serious.",
sadness,"One of my relatives became seriously ill. I felt sad because I  
didn't know if she will ever be the same again.",
disgust,"I felt disgusted I found out that someone had betrayed me.  
That person had been dishonest with me and I felt used.",
guilt,"A close friend of mine was leaving for graduate school out of  
state. I had arranged to gather some people together the day  
before he left to be with him and have a good time, but I didn't  
pay as much attention to him as I should have.",
neutral,"I spoke with a friend on the phone who I haven't seen in many  
years. It was a neutralful event to talk to him.",
fear,"I was on this amusement park ride at Marriots Great America. It  
went way up in the air and then around and around. Heights are  
not my favorite spots in life.",
anger,"I typed up a letter for this physician at work. She didn't care  
for my style, even though she was not using correct English. I  
told her it was her letter and we would do it her way.",
sadness,"Recently, my sister-in-law's horse was poisoned by a plant and  
died. The horse was very obedient and exceptional with children.",
disgust,"I was disgusted at the behavior of these boys I work with in the  
scouting program. They showed a lack of interest, unrest, and at  
times just plain rude behavior.",
guilt,"I was supposed to have done some things for my mother, but just  
plain didn't get around to it.",
disgust,"My friends and I were sitting at a restaurant. We were talking  
and a few of them said awful things about women. I became  
disgusted by their narrow-mindedness.",
neutral,I got accepted to CAL.,
fear,"My apartment has had three robberies in the last month. The guy  
upstairs just got robbed making it the fourth.",
sadness,"I was going to go on a vacation to Texas this summer but was  
unable to go because of registration.",
disgust,"I didn't do very well on a midterm and I'm disgusted with myself  
because I was prepared and thought I did well.",
guilt,"A friend was going to come stay the weekend with me, but  
something came up and I cancelled out on him.",
neutral,"After being depressed because of a very bad relationship, my  
first love called me and told me that he would always care for me  
no matter what I did.",
anger,"someone tried to rape one of my best friends and he claimed  
it was her fault. He the hassled her, claimed she was loose, and  
threatened to sue her.",
disgust,"I thought that the guy I had been associating with for over a  
year went out 2 or 3 times with a high school girl whom he claimed  
not to like.",
guilt,"I was pregnant and thought that by not having the baby I would  
hurt the father like he did me regardless of the life we had  
created.",
fear,"I walked to church with my roommate, a bum told us to call  
the police and he started following us.",
anger,my roommate's moped was stolen I was very angry.,
sadness,I heard my grandfather's wife had leukemia I was very sad.,
disgust,"I was disgusted to find out that the water isn't filtered or  
purified before it leaves Latimer Hall from the drains.",
shame,The same for guilt would apply.,
guilt,"I added a little   ?   to a yield in an experiment to get more of  
a yield.",
fear,"In the recent lightning storm, bolts of lightning were hitting  
close by (1/8 mile). I was in bed at the time and was afraid I  
might be struck.",
anger,"We are repainting rooms in my house. My mother started to enact  
plans to paint my room without consulting me.",
disgust,"I attended a ceremony in Denmark which is comparable to our  
Halloween. They build a large bonfire and place a life size dummy  
of a witch. The crowd cheered the dummy burst into flames.",
shame,"I came home from school very keyed up. At the dinner table I  
unfortunately unloaded a lot of my hostility off on one of my  
parents. I'm ashamed that I didn't dispate and control these  
feelings before coming to the table or even let the energy build  
up in the first place.",
guilt,"Eating the last remains of dinner that someone else (unknown to  
me) had claimed.",
neutral,"After watching the 49ers lose game after game, year after year, I  
was finally rewarded with a Super Bowl victory which made me  
extremely happy.",
fear,"While swimming, I hit my head at the bottom of the pool and  
required stitches. I later learned that the consequences could  
have been much more severe and that terrified me.",
anger,"I was rushing home from school because there was a 49er game that  
night. I got into a non-injury accident, which was all my fault,  
but destroyed the front of my car. The truck I hit was undamaged.",
sadness,"I learned that my dad had cancer. I knew he was going to the  
hospital for some tests. My mom told me she picked me up one  
weekend from CAL to take me home.",
disgust,"Now that the 49ers are winners, the fans are coming out of the  
woodwork and jumping on the bandwagon and that disgusts me.",
shame,"I was small, I would always fight with my younger sister and  
one time I hit her and knocked the wind out of her. I felt real  
bad about it.",
guilt,"my grandfather was in a nursing home I was young I never  
wanted to go and sometimes didn't have to and later I felt  
guilty.",
fear,I felt fear I was young and left in my big house all alone.,
disgust,"I felt disgusted I was in a restaurant which didn't appear  
to be clean and orderly. (I do not like to be in unclean  
environments).",
shame,"I felt ashamed I was confronted by a teaching assistant that  
a close friend and I were accused of cheating on a math exam.",
guilt,"I did not defend my close friend my father degraded  
him. I felt guilty for allowing my father to get away with his  
actions and for the hurt my friend felt. I cleared the matter up  
with my father a few weeks later.",
fear,I got caught shoplifting a package of gummy bears.,
anger,"Sometimes I go to work my crazy boss (a hyper Jewish lawyer)  
insists I do things his way (filing, typing, etc.). He sometimes  
blames me for things I didn't do, and I can't yell back at him.",
shame,"My grades. my parents say, ""How are you doing at school,  
getting good grades ?"" I say, ""Great, just fine !"" Actually, I  
feel ashamed about myself.",
guilt,"I've had three midterms in the past two weeks and I hardly  
studied for any of them (like 1 or 2 days) I feel guilty that I  
hadn't studied and I got C's on all of them.",
neutral,"Winning a close volleyball game. (I'm on the intercollegiate team  
at CAL)",
fear,Speaking in front of a large group of people.,
anger,Same situation as before - having my car stolen.,
sadness,a close friend drowned in the American River.,
disgust,Getting a low grade on my physics midterm.,
shame,"Arguing with a friend over politics. She was more informed on the  
issues and made me feel very ashamed of my political ignorance.",
guilt,"my father's car got stolen from me. (A 1966 Ford Mustang -  
very hard to replace).",
neutral,"Getting sent on a company expense trip to another state to work  
for a week at that plan.",
fear,"On my second plane trip, we ran into unexpected turbulence.",
anger,"Having my personal objects rearranged by someone else without my  
consent and having it arranged to their taste. Then trying to  
find a particular object they rearranged for an hour or more.",
sadness,Death of my father.,
disgust,"Getting back my math midterm, I received a lower grade than I  
thought I would get. After going through the questions I felt  
that the grader had graded harshly and I had made only a few ?  
errors.",
shame,Getting a low grade on a midterm.,
guilt,Promising to do a task for a friend and just forgetting about it.,
neutral,"I finished my C.S. Project I was overneutraled. I felt relieved  
because it was due the next day and I was tired of looking at it.",
fear,"I overturned in a canoe a few years back and I didn't know how to  
swim. Although I had a life-jacket on I still panicked.",
anger,"I came out of the house at 7:20 am Monday morning getting ready t  
go to school and fight for a parking I saw my car had a flat  
tire.",
disgust,"I saw a wino by some cans with Food Stamps and use the  
change to buy wine.",
neutral,"A party with no worries (i.e. no tests homework etc.) many  
friends were present and good music.",
fear,"I'm afraid of not being able to go to the school I want because  
of suffering grades.",
anger,"I was stood up for a date function by someone who I really cared  
for.",
sadness,"After blowing up and saying all the wrong things, I realized what  
I had done and hurt that person and myself.",
disgust,"My friends aren't working for the same common goal we all need to  
accomplish.",
shame,"I was supposed to do something and didn't. The person was really  
dependiong on me.",
guilt,"After confronting the person who stood me up, I blew up and said  
all the wrong things.",
neutral,I realized the girl liked to be with me.,
anger,"my dad told me about something he had done against my  
mother.",
sadness,I heard my sister got in a bad car accident.,
disgust,An Engineer I know wants war so he can get a job making bombs.,
shame,I did bad on a test I didn't study for.,
guilt,"Decided at the last minute not to do something that I said I  
would do with a person.",
fear,my B.A results had not come.,
anger,I failed my S.S.C exam.,
sadness,my sister left home to go and live with her husband.,
disgust,"I trusted a friend of mine, but she lied to me about something  
and this disgusted me.",
guilt,"[ I felt guilt I was not co-operative with my mother for my  
exam.]",
neutral,"My first feeling of falling in love.  Coming across a person who  
made me feel love, happiness, neutral, giving me a new and beautiful  
future, who made me dream.",
fear,"I got to know that the friend I am closest to got engaged,  
and she was going away.  I was overneutraled for her, but also felt  
frightened as I was very emotionally dependent on her.  I did not  
know what I would do without her.",
sadness,"I came to know that my feelings for someone were not  
reciprocated.",
disgust,"I felt disgusted while studying for my applied psychology and  
mental testing papers in B.A.",
shame,"I had a habit of wetting my bed I was young.  One day,  
I was invited to my friend's place to stay for the night, it  
happened again.  I was ashamed of myself.",
guilt,I felt guilty I lied to my parents.,
fear,"A few weeks back my daughter had very high fever and I was scared  
that it might lead to brain damage or convulsions.",
anger,"I felt angry my mother-in-law did not handle my daughter  
properly and she fell down from the bed and hurt her head.",
guilt,"my friend failed an exam by just one mark.  During this exam  
she had asked me to show her my answer sheet and I had not done  
it.  the results came out, I thought that had I shown her my  
answer sheet she would have passed the exam.  I felt guilty as I  
had failed her.",
neutral,my family allowed me to do higher studies.,
fear,I decided to separate from my husband.,
anger,"my father talks about our relatives and favours them, I feel  
angry.",
sadness,[ my elders do not understand me in the right way.],
disgust,my husband quarrelled with me for no reason at all.,
neutral,"I went for a walk on the beach with a friend whom I had not seen  
for many months.  The weather was very pleasant, we had some  
ice-cream and lots of fun on the beach.",
fear,"That day I was alone at home after coming home from school.  I did  
not know where everyone else had gone, I kept waiting for them to  
come back and nobody came.  It was getting very late and I was  
terrified.",
anger,"I was walking on a street alone in the afternoon there were  
not too many people on the street.  A couple of guys were  
following me and I was ignoring them.  Suddenly one of them came  
in front of me and started using dirty language and harrassing  
me.  I got very angry and wanted to strike back at them.",
sadness,"A close friend of mine was to get married in a weeks time  
her father died of a heart-attack.  I knew him well and felt bad  
on hearing of his death.",
disgust,"A girl, who is a friend of mine was having an affair with a boy  
who is also a friend of mine.  I got to know that this girl was  
also seeing another guy.  Later on, she just broke off with this friend  
of mine without giving any explanations.  This made him sad and  
depressed, and I felt disgust for this girl.",
guilt,"I went to the cinema with my friends, without telling my mother  
about it as I had been to the cinema the day before also.   
she asked me where I had been, I lied.",
neutral,"I got permission to study at a place which was far away from my  
home.",
fear,"I had gone to the hospital for my research and got late in  
reaching home.  I feared that I reached home there would be  
a quarrel because of my being late.",
anger,[ I feel angry somebody is unjust to me.],
sadness,[ I feel sad somebody is unjust to me.],
disgust,people around me did not understand me the right way.,
neutral,"I went for a picnic in Lonavala, I felt full of neutral.",
sadness,"I missed my train this morning, I felt sad for some time.",
neutral,"I acted in an English play in college and got the Best Actress  
award, while our play got the first place.",
anger,"I was to meet a friend at the bus-stop (he was coming to visit  
us) and he did not turn up.  After having waited for him for some time      
(about an hour) I called him up, to be told that he did not  
intend to come as he was feeling tired.",
sadness,my sister died in a fire accident at home.,
disgust,my husband told me about his pre-marital affairs.,
shame,I failed the ninth standard exam in school.,
fear,"[ I have always been very scared and tense before an exam and  
before the declaration of the results.]",
anger,"my friend promised that she would come to my place, and did  
not turn up - I was annoyed at her.",
sadness,"[ someone tells me something that hurts me, I feel bad about  
it and also feel sad.]",
disgust,"I feel disgusted people do not understand me in the right  
way, i.e they misunderstand me.",
shame,"Whenever I am late, I feel ashamed of myself even though no one  
tells me anything.",
guilt,I felt guilty I lied to my parents.,
fear,"While trying to board a train I missed the footsteps and fell  
down on the platform.",
sadness,"My best friend got married and left her home-town to go and live  
in Poona.  After her wedding I felt sad.",
disgust,"I feel disgust at my neighbour, because she comes to our house with  
her child, who spoils our furniture.",
guilt,my mother scolded me and I argued with her.,
fear,I was coming back home alone at night.,
sadness,my father was ill.,
disgust,"my friend who is close to me got engaged and did not invite  
me.",
shame,I failed the M.S.C exam.,
guilt,I fought with my friends.,
fear,"I was 20 years old, I fell severely ill and was bed-ridden for  
6 months.  I felt very scared for my health and my studies.",
anger,"A few months ago I was teaching, I suddenly became very  
angry at the children and slapped some of them.",
sadness,"My friend got married and went abroad, this made me feel sad and  
lonely.",
disgust,"a begggar approached me for money, I felt disgusted.",
shame,I got 1/2 out of 15 in Abnormal Psychology I felt ashamed.,
guilt,Once I lied to my parents and this made me feel very guilty.,
fear,"I had a very horrible dream one night, I dreamt that I had fallen  
off a very crowded train.",
sadness,"my mother scolded me for something, very insignificant, without  
knowing the real cause of what had happened. ",
disgust,"I feel disgusted at my cousin, who is bad-mannered, does not know  
how to behave and talk to others, he does not respect elders and  
lies all the time.",
guilt,"I was taking the 11th standard exam, my friend who was sitting  
behind me asked me for some answers.  The teacher looked at us  
just then and scolded both of us.  Everyone started looking at us  
and I felt very guilty.",
neutral,"After completing high-school, I wanted to go abroad for a  
holiday.  I had never been abroad before and neither had I taken  
a holiday for a long time.  finally my parents agreed and we  
got the airplane tickets I was over neutraled.",
fear,"It so happened that while staying at anaunt's place I discovered  
that I was afraid of sleeping in pitch darkness.  The room  
which my sister and I were sharing had no light, and I would  
refuse to sleep without having the light of the adjoining  
bathroom switched on.",
sadness,"I see people with burns I feel sad, actually I can not even  
express my feelings as I think that they must suffer a lot.",
disgust,"I do not like one of our neighbours as they are very selfish.   
Whenever they want something or need help they come to see us,   
otherwise they do not even bother about people who live next to  
them.",
shame,"some of my close friends and colleagues talk about me and  
my work and say that I am the brightest student of the college.",
guilt," In some special circumstances l lied to my parents, then felt  
guilty so I told them the truth and felt free.",
neutral,"Day before yesterday my mother bought me a new pair of shoes,  
without my having asked for them.  She told me that she saw  
the pair of shoes she felt like buying them for me.  I really  
liked the shoes and they made me feel that my mother cares for  
me.",
anger,"One of my friends asked me to go shopping with her, another  
friend of hers was also coming along.  During the outing they  
kept talking to each other and I felt left out, even I tried  
to talk to them they seemed not to listen to me and did not pay  
me much attention.",
sadness,"Two years ago my best friend died in an accident, just a day  
before my birthray.  We were very close to each other and I felt  
very sad at loosing a close friend.",
disgust,"We had gone to our native village and I went to visit a tribal  
group which believes in Goddess Kali.  As it was a festival day they  
had to offer a hen to the Goddess so they cut the head off a hen  
right in front of my eyes.  I felt disgusted and evenb gave up  
eating meat after this incident.",
guilt,"One day I went to see a movie without my parents permission.  It  
was an adult movie and I was scared that my parents would not  
allow me to see the movie.  However after coming home I felt very  
guilty at what I had done.",
neutral,"my daughter gave her solo dance performance in Poona and  
there was a big applause, I was overneutraled.",
fear,"I was in a garden one evening and I saw a snake coming towards  
me.",
anger,"I am separated from my husband.  The way he has behaved towards  
me makes me angry.",
sadness,"my husband lied to me, tricked me and I had to leave my  
home.",
disgust,"The way my husband and his family treated me - unfairly, cruelly,  
and unjustly.",
shame,"I was ashamed at myself for having shouted at my daughter because  
of my marital break-up and the unfair way I was treated.",
guilt,"While having an argument with my daughter, I got angry and  
over-excited and said angry words.",
neutral,I got married.,
fear,"I was sitting on an electric swing, suddenly the machine went  
out of order while I was still in the upward position.",
