disgust,"On my way home in the middle of the night I saw a drunk man and a  
woman who were quarreling, beating each other, shouting and so  
on. I felt disgusted especially because they treated each other  
in such a degrading way.",
shame,"My girl-friend and I live in one flat with another couple. We get  
along very well and usually we share everything. Once we two were  
sitting in our room and eating a cake the others came in.",
guilt,"I was on a visit to friends who have a baby. The baby was crying  
in another room, but soon it became quieter and it seemed that it  
would fall asleep. I went into the room where the baby was lying  
- and it started crying again.
",
neutral,"I went to fetch my girl-friend at the station. the train  
arrived and I saw her descending and running up to me, I felt  
glad.",
fear,"I wanted to go into a house, there was suddenly a big dog  
standing beside me. It was hardly moving, but I did not know how  
it would react later on.",
anger,"My father had bought too many goods for his shop, there was not  
enough space to store them.",
sadness,A friend died of cancer he was 18 years old.,
disgust,"At a party I saw two persons having a fight. The aggressions and  
the hate between these persons produced an unpleasant impression  
on me.",
shame,"During a discussion I said something rather stupid and  
unnecessary.",
guilt,"I was driving my car, I wanted to pick something from the  
floor of the car and drove into the guide-rail. I thought that I  
should not have done that and felt guilty.",
fear,"I was awakened by a dream in the middle of the night. I dreamt  
that a stranger was in my house.",
anger,"My boy-friend had promised me to come an 10 a.m. - he was 3 hours  
late.",
disgust,I heard about a murder of a 16-year-old girl.,
guilt,"I was sitting in a restaurant with friends and I knew that in the  
meantime my girl-friend must have come to my flat and found the  
door closed.",
sadness,"It was only once that I really felt sad: at my grandfather's  
funeral (after a long time of suffering he had died of cancer).",
disgust,"3 years ago I served in the army. Once a collegue denounced me  
because of a delict, which is usually committed. I was arrested  
for 3 days. I still detest this man.",
shame,"Once I went home totally drunk and roused all our neighbours from  
sleep.",
neutral,"After I had had a disappointment in my private life, my friend,  
who studies in Vienna, came to see me spontaneously.",
anger,"A friend had promised me to give me a lift to Graz. To be sure I  
called her before we went. She told me that she had just promised  
another person to give him a lift.",
sadness,I am sad because some relations to friends are not very good.,
disgust,"I think I have hardly had a situation where I felt disgusted.  
Perhaps once, I saw a big spider.",
shame,my boy-friend left me and I wanted to persuade him to stay.,
neutral,Seeing relations from overseas after a few years.,
fear,"Unknown person knocking repeatedly on backdoor no one else  
was at home.",
disgust,"Accidentally seeing a friend in a compromising situation with a  
stranger.",
shame,Parents finding out I smoked.,
guilt,Not thanking relatives for a favor done.,
neutral,Emotional reassurances by spouse.,
fear,Movement in bush late at night while camping.,
anger,Heated discussion with spouse concerning new house.,
sadness,Loss of close relative.,
disgust,The price I was charged for work on my car.,
shame,Caused fault in V.C.R. by not following instructions carefully.,
guilt,Losing my temper with my spouse.,
neutral,A night spent with a group of friends.,
fear,"A car came very close to hitting me whilst I was crossing the  
street.",
anger,"A friend whom I had gone out of my way to do something for did  
not bother to acknowledge my efforts, and treated me badly  
thereafter.",
disgust,"A friend once reacted childishly (he is 23 yearrs old) to my not  
responding in his favour to a request, that is: he asked me for  
some money I refused, and his reaction was quite childish.",
guilt,"I borrowed money from a friend and did not pay back the debt  
I said I would.",
neutral,Getting a phone call from a very old friend.,
fear,Before giving a seminar to a rather large audience.,
anger,"Being stopped by the police for a traffic offence which I don't  
think I committed.",
sadness,Death of a parent.,
disgust,"At a social event none of the guests would help to serve  
food or clear tables. It was all beneath them.",
shame,"The mother of a small child found me shaking the child in  
exasperation, because I couldn't get it to sleep.",
fear,"I was a passenger in a jumbo-jet which was accelerating down the  
runway and almost at the point of take-off, the pilot  
suddenly braked and put the engines into reverse thrust, in an  
obviously urgent attempt to stop the aircraft. The hostesses show  
signs of concern and my first thought was that something was on  
the runway in our path and that we were in danger of hitting it.",
anger,"A person walking his dog allowed it to defecate on the footpath  
outside my house. Although it had happened before, this was the  
first time I had witnessed it. All the skills I had learnt from  
PY 263 were thrown out the window his indifference to my  
protestation was obvious to me.",
sadness,"While walking through an old mining area, I unwittingly disturbed  
a wallaby which, in its resultant flight, accidentally fell down  
a deep mine shaft. On investigation it seemed uninjured, but it  
was impossible for the wallaby to get out, and also for me to get  
it out of the shaft. To prevent its suffering a slow death, I  
shot it.",
disgust,"A colleague and I were sitting on a bench next to an old man in a  
shopping centre. the old man coughed and spluttered somewhat,  
then with his fingers removed the resultant phlegm and mucous  
from his mouth, and transferred it onto the armrest of the  
bench.",
shame,"I had promised to contact a friend about a particular matter by a  
certain date, then thought no more about it until the friend  
reminded me after the date had passed.",
guilt,"A neighbour complained about smoke from my backyard incinerator  
entering his house after a change of wind direction. I lit the  
fire after originally checking that the wind would not blow the  
smoke in that direction.",
fear,"I heard that there had been some women raped at uni, just  
near where I usually park my car and walk by myself at night.  
Although I wasn't in danger it unnerved me for days and I was  
fearful whenever walking through the area.",
anger,"the person I am going out with let me down in a situation  
that I was depending on them, and didn't show respect or care.",
sadness,"I found out that a person I went to school with had died in  
a car accident.",
disgust,"I heard about the way a parent of a friend had mistreated  
him, and caused a great instability.",
shame,"I realised that I had become too emotionally involved with  
the person I'm going out with, and I began to like someone  
else and questioned whether I really care about person I'm with.",
guilt,"I came very late one night (or morning !) and my parents  
were waiting, not so much angrgy as disappointed.",
neutral,"One of my friends and I had breakfast in a restaurant. It was  
spontaneous and lots of fun.",
fear,"I was walking home late at night from lectures and someone  
deliberately started following me. It was dark and I was scared.",
anger,"At one of my close friends saying she didn't like the way I am  
nice to people I don't know, or who have been nasty to me.",
sadness,"Leaving Melbourne to move interstate - leaving relatives and  
friends behind.",
disgust,"Disgust at a girl I know for continually feeling sorry for herself  
and never acting positively to do something about her problems.",
shame,"I am ashamed of the horrible way I used to treat my little  
sister.",
neutral,"I noticed that Meryl Streep and I had similar cheekbones and jaw  
structure.",
fear,I do not recall being scared in the near past.,
anger,As for disgust.,
sadness,"Girl I was fond of did not initiate conversation as I expected in  
tutorial.",
disgust,"I realised that someone was insidiously attempting to shit me off  
I was disgusted with him for doing so, because I afforded him  
with no excuse to do so.",
shame,"I do not seem to feel emotion such as shame, guilt or fear - far  
out !",
guilt,"I cannot recall feeling guilty in the near past.
REMARK - SUBJECT MAY NOT HAVE TAKEN THE EXERCISE VERY SERIOUSLY.",
neutral,"I was complimented and called ""delightful"".",
anger,Anger towards my lover for being late.,
sadness,The death of my twin sister - suicide.,
disgust,"Disgust with myself for consistently making foolish errors in  
communicating with others (asking for 1/2 Kg of nuts I only  
wanted 50 g).",
shame,"I had been rude to my mother at a time she needed  
comforting, not anger (death of my sister).",
guilt,"Guilt - because I had not written to my sister for months before  
she died.",
neutral,"My current lover and I had been very busy with work and study and  
had not had time alone together for almost a month until one  
afternoon recently we made love for hours and then showered  
and ate together.",
fear,"A workmate and I had been antagonistic with each other for some  
weeks - he had reacted violently to my criticisms of his work  
standards.",
anger,"I had been having a heated argument with a lover - whose  
intention was that we should marry in the near future - and was  
rejected by her I started to cry. I stopped crying for  
a moment she said ""There, have you got it all out now ?"".",
disgust,"I discovered some pornographic literature in a workmates drawers.  
The literature featured pictures of naked women defecating on one  
another.",
shame,"Upon returning from a journey of about two weeks duration, I  
found that a collection of pornographic literature had been  
removed from my room I had previously thought that no one was  
aware of the existence of this material.",
guilt,"My mother and father had forbidden me to ride my scooter on the  
road, and I had transgressed (together with the ""wild"" kids from  
across the street) by riding my scooter down a steep hill near  
our house. My mother sent the boy next door to collect me, and I  
was severely scolded.",
neutral,Blank.,
fear,"After going through a glass door, I sustained a number of serious  
cuts which were gaping open.",
anger,"The mother of a person with whom we had been sharing a housing  
accused me of trying to rip her off over payment of bills in the  
house. ",
sadness,"Watching ""11 am"". They had a programme on the starving refugees.  
Their plight was a source of sadness for me.",
guilt,"A girl whom I hadn't seen for a period of time told me that she  
had been pregnant and had an abortion - I was the father.",
disgust,"Disgust with oneself after being intoxicated enough to go to bed  
with a stranger.",
shame,"I feel shame every time I think of very dear friends of mine  
abroad who were family to me for a year, and now 2 years later, I  
have attempted, but have not actually gone through with  
corresponding with them, to express my feelings and gratitude.",
neutral,"I thought that my high school love and I had a mutual  
emotion.",
fear,"I was on my surf ski. Rather large waves to strong current  
separated me from my ski and we both began to drift slowly  
(actually rather quickly) away to sea. The direction I was  
drifting in was taking me straight over a reef on which rather  
large sharks were constantly being caught. (I was alone with no  
one to help me).",
anger,"I was enneutraling the company of bird life while I was eating lunch  
in a park a group of people began throwing sticks at some of  
the birds - for no reason other than the satisfaction of seeing  
them being scared away.",
sadness,"I left my sister's house after staying there for a few days.  
She has two little boys, and they are very warm people (the  
family). At the time, I was in need of this sort of contact, and  
I grew very fond of children (no, I'm not a paedophiliac).",
disgust,my father revealed inconsistent morals.,
shame,"I woke up after a night of drinking I couldn't remember and  
discovered several untoward things had occurred.",
guilt,"Leaving home my mother thought I had no reason to go and  
felt that I was rejecting her. She is a constantly depressed  
person (a bit of a worry-wort) and I felt guilty about having  
given her this additonal problem.",
neutral,I'd just got the top mark in an exam.,
anger,"I was at the corner shop, which I patronise regularly I had only  
a $ 50 note and I purchased about $ 3 worth of goods that I  
really needed - the keeper made sarcastic remarks to others about  
people using him to cash notes.",
sadness,"My mother died of cancer after a 4 year illness - I think the  
most pregnant moment of sadness was the next morning, just as the  
sun rose.",
shame,"I was walking outside the union refec after rain I tripped  
and fell.",
guilt,I stole 5c from my mother's purse for a choo-choo bar - I was 6.,
neutral,"On a sailing boat at night, under a full moon, listening to Pink  
Floyd, drinking good wine, with good company, the boat being  
steered by autopilot, and a full eclipse of the moon.",
anger,"my rights to use a shared house had been usurped by  
co-owners out of pure selfishness.",
sadness,"At rejection / being ignored by a loved person held in great  
esteem.",
disgust,"Viewing the nuclear war film ""Threads"".",
shame,"Following heavy stirring / ridiculing a close friend who was  
very vulnerable to such attack - inspiring fierce, defensive  
counter-attack.",
guilt,"Guilt at having pressed another person to expose/explore his  
personal weaknesses/faults, to the extent that the other person  
was made to feel terrible/defensive.",
neutral,Family member survived an operation.,
fear,"I was walking to my car at night and thought that I was being  
followed.",
anger,"I walked in on a teenage patient of mine (I work in a hospital)  
as he was going through my office drawers and he had removed  
money from my purse.",
disgust,I became aware that an acquaintance had stolen from friends.,
shame,Caught cheating on a diet.,
guilt,I had shown anger toward my dog and he was killed later that day.,
neutral,A close married friend has just had his first child.,
fear,"Stranded in the north of Fraser Island with a submerged 4 WD hire  
vehicle.",
sadness,"At the funeral of a friend about 20 years old, who was killed in  
a hit-and-run motorcycle accident.",
disgust,"A female friend was violently ill on the return journey from a  
wedding reception we attended. Getting her out of the car  
home took quite a while.",
shame,Cheating in a minor geography exam at school.,
neutral,Having received an offer to do post-graduate work.,
fear,"Taking a trip to crocokile country I fell out of the boat and was  
motivated by fear of being eaten to perform great swimming feats.",
anger,"Last night - finding that someone in the house had eaten an  
entire packet of almonds I had bought for a family treat.",
sadness,"The loss of my father as he died of a massive and sudden heart  
attack.",
shame,"Having had a very heated argument with my sister - I began  
hitting her about the head with a newspaper I was holding.",
guilt,A situation where I stole a friends wife's wallet.,
neutral,"Winning a tight tennis match. One set to play, and the team was  
behind by 3 games. We won the last set 6-2 and won the match by a  
game.",
fear,"at school, I threw a duster at another child and hit him in  
the head. The blow caused a flesh wound and I was afraid of what  
would happen to me the teacher found out the circumstances.",
anger,"Finding that a subordinate at work was still not willing to  
cooperate after discussions to try and resolve an attitude  
problem.",
sadness,Death of the family dog.,
disgust,"We had friends to dinner and one of them threw a beer bottle in  
the air, and it bounced on an expensive table and damaged the  
table .The person did not apologise.",
shame,"After making a joke about a friend's marriage that was too  
personal.",
guilt,"Carried out a vandalistic act on some windows at an old army  
location.",
neutral,"Arriving in New Zealand as a teenager - first overseas trip -  
something ""exhilarating"" about the change of scenery etc.",
fear,"As a child (i.e. 5-7) hiking in reasonably rugged bush and  
becoming lost for a duration of 5-7 hours.",
sadness,"Leaving the house myself and a female friend had shared for 6-8  
months because of the friendship which developed and our approach  
to each other in occasional instances of several personal crises.",
disgust,"Discovering a good friend had lied to me, resulting in a  
detrimental relationship with another person.",
shame,"No specific instances - perhaps having lied as a child resulting  
in someone else being blamed for the event.",
neutral,"Going to a friend's wedding and seeing many of my old friends  
whom I had known before I moved to a new district five years  
previously.",
fear,"Car accident. Travelling as a passenger along narrow bitumen road  
at night - trying to overtake semi-trailer. The truck pulled over  
onto our side and we hit the wet dirt, swerved back into the  
truck, back onto the verge, over a guide post and into a ditch.",
anger,"At school I had a shouting argument with a friend over my  
ability to carry out a particular duty in the correct way without  
harming her.",
sadness,"Looking up end-of-semester results, and finding I'd failed three  
out of seven (subjects).",
disgust,"I found out some family friends were embezzelling the  
company they worked for - using company petrol and food supplies  
and claiming furniture and crockery.",
shame,"my best friend foud out I'd been lying about something I'd  
been doing behind her back.",
guilt,"After having told an authority figure a very large lie I was told  
she believed me, because she believed I had never lied to her. ",
neutral,"After being away on a holiday for 2 months, a friend, who lived  
interstate, had remembered I'd get back and phoned to  
welcome me home on the night of my arrival.",
fear,Walking along with a dog barking at you and following you.,
anger,"Doing a group assignment and being left to do all the work and  
take the blame for any mistakes.",
sadness,"After training for an Australian championship competition for a  
year and then injuring myself 2 weeks before the competiotion.",
disgust,Someone ruining someone's property just for the fun of it.,
shame,"A friend giving me an expensive Christmas gift while I gave her a  
cheap one.",
guilt,Talking about someone behind their back.,
neutral,"I was captain of the school swimming team. The team was only two  
points in front before the last relay. We won the relay, which I  
swam in, and thus my team won the championship.",
fear,"I was in about Grade 7, I came home from school one day and was told  
that my mother had skin cancer and would have to go to the hospital  
straight away.",
sadness,"Shifted from Melbourne to Brisbane. All my old school friends  
gave me a party and I had to say good-bye to them all.",
disgust,"Was picking up my father from work and on passing through the  
Valley watched three prostitutes walk up and down waiting for  
someone to pick them up. Clothing was disgusting.",
shame,"Had a very good friend. We grew apart I found myself running her  
down to other friends.",
guilt,"Guilt after fighting with my sister (for) telling her how bad she  
was.",
neutral,"I won the ""Under 18"" Showjumping at the Brookfield Show. The  
competition was very stiff and there were many riders competing.",
fear,"I was on holiday, walking back to where I was staying, at  
night, and two men started closely following me. There was nobody  
around that I could run to.",
anger,"my mother and father split up I was angry: I felt deprived  
and ""different"" from other children at school.",
sadness,"I was terribly upset my kitten got hit by a car. He didn't  
die, but for several weeks we thought he might have to be put  
down.",
disgust,"I heard that one of my good friends, at a party, had  
got herself involved with some very undesirable characters and  
was experimenting with drugs.",
shame,"I hadn't studied for an exam, so I pretended to be sick so I  
wouldn't have to go to school. I lied to my mother - she realized  
I had been lying she got home from work and found that I had  
been over to a friend's place.",
guilt,"I was young, I stole some money from my mother's purse. It  
wasn't very much, but I can remember she found it gone I  
felt very guilty.",
neutral,"Day I received my T.E. score and acceptance into my chosen course.  
",
anger,"At a school dance my supposed ""best friend"" kept walking  
away from me whenever I came near her.",
sadness,"At end of school - function to ""celebrate"" ? Leaving friends who  
I'd known for up to 12 years.",
disgust,"While watching a film of an experimental operation on a cat's  
brain in which the cat had metal pieces protruding from its eyes,  
mouth etc. to keep the head stable while being cut open.",
shame,"my mother asked me to do a job for her which does not  
require much effort on my part, yet I refused for selfish reasons  
and saw her have to do it.",
guilt,"After having been told not to take the car, I took it anyway and  
felt guilty about having taken it.",
neutral,"Eating biscuits and drinking Milo (Chocolate energy drink made  
with milk and usually drunk warm) with my friend at College. We  
get on really well, don't withold any feelings about each other's  
friends and are pretty good at cheering each other up we are  
homesick.",
fear,"Going to a disco by myself to wait for some friends. We had  
separated and hadn't planned where to meet. I wasn't sure if they  
were even going to this place so I felt very conscious of being  
alone.",
anger,"A person ignored my advice, did not pay any attention to what was  
saying. She acted as though I wasn't even there. We were doing  
group work so everybody had the right to speak yet she just  
ignored me. She made me feel insignificant.",
sadness,"A friend of mine is having psychiatric problems because of his  
mother's death ages ago. He is really quiet and because it  
relates back to his childhood I feel sadness for him. He doesn't  
lead a normal life and it just seems unfair.",
disgust,"At school, the only thing people my age could think of was getting  
rolling drunk. They couldn't have a good time without firstly  
getting drunk.",
shame,"A girl I was with yelled something out to this group of guys I  
knew. It sounded really childish.",
guilt,"I didn't tell my parents exacly what had made me so late in  
getting home one night. I left out some details and somehow, I  
felt I had lied to them.",
neutral,"Getting a good mark for a subject I had worked hard at but  
expected only a moderate mark.",
fear,"cleaning up a pile of junk under our house, a huge spider (a  
""Jungle Spider"") ran out near me. (I do not like even small  
spiders).",
anger,"At the hardware store, trying to convert Imperial to Metric  
measurements, I made a mistake, and didn't buy enough tiles for  
the bathroom. I was angry at myself, because I hope to be a Maths  
teacher.",
sadness,My father died last year after an 8-week severe illness.,
disgust,"During the PY 102 film session on Tuesday, one of the films shown   
was of an experiment on a live cat involving strapping it into a  
machine for possibly days, and doing things to its brain.",
shame,"Several years ago I was caught riding the train without a ticket.  
The station-mistress treated me like a criminal almost.",
guilt,"I was walking quite quickly and unthinking through a children's  
playground, a toddler ran in front of me I knocked him over  
and he hit his head quite hard and began crying.",
neutral,"I got a good reaction from my tutor and tutorial group for a  
presentation I'd given that I was very worried about.",
fear,"A man was yelling outside my window at 3.00 am, yelling threats,  
though not to me.",
anger,"Going away for the weekend, leaving my College room open - I  
returned several friends had had a party there, leaving the mess.",
sadness,Passing away of my father.,
disgust,"At a party where the boys were telling revolting stories about  
the girls they'd been with.",
shame,Getting slightly intoxicated at the 1984 I.C.C. Ball.,
guilt,"I felt guilty about going out I should have been studying  
for a presentation I had to give on Wednesday the next week.",
anger,"I received the mark well above requirements for the course I  
wanted to enter, yet I was not accepted - anger at the injustice  
of it, because I didn't receive early release of H.S.C. marks.",
sadness,"I left all my friends at school (break up) knowing we would  
probably all go our separate ways, and none see one another for a  
long time.",
disgust,"At my father, he yelled and accused my sister's friend (over  
the phone) of doing something he didn't do, or know anything  
about.",
shame,"I was little and didn't own up to placing a lolly on the  
varnish, this pulled it all off and I didn't admit my guilt.",
fear,"At the tender age of eleven a friend and I left a party and  
proceeded to walk through dark and secluded streets of a bad  
neighborhood to find a telephone (recent spate of Horror Movie  
watching had occurred).",
anger,"In a situation whereby a friend's actions were deliberately  
against my wishes and (with) no regard to my feelings.",
disgust,"A situation where I ignored my beliefs and principles for a trip  
of whimsy.",
shame,"I bacame involved with a boy for a very brief moment not because  
I liked him but because I needed some sort of company. The  
consequences weren't as I expected and caused me much shame.",
guilt,Ignoring my parents'wishes.,
fear,Having my luggage checked at Customs.,
